{"$id":"https://harness.planeon.ai/schemas/v1alpha1/runtime/replay-record.schema.json","$schema":"https://json-schema.org/draft/2020-12/schema","additionalProperties":false,"properties":{"apiVersion":{"$ref":"common.schema.json#/$defs/apiVersion"},"kind":{"const":"ReplayRecord"},"metadata":{"$ref":"common.schema.json#/$defs/metadata"},"spec":{"additionalProperties":false,"allOf":[{"if":{"properties":{"state":{"const":"RESERVED"}},"required":["state"]},"then":{"properties":{"receiptDigest":{"type":"null"}}}},{"if":{"properties":{"state":{"enum":["COMMITTED","REJECTED"]}},"required":["state"]},"then":{"properties":{"receiptDigest":{"$ref":"common.schema.json#/$defs/sha256"}}}}],"properties":{"admissionDigest":{"$ref":"common.schema.json#/$defs/sha256"},"expiresAt":{"$ref":"common.schema.json#/$defs/timestamp"},"firstSeenAt":{"$ref":"common.schema.json#/$defs/timestamp"},"idempotencyKeyDigest":{"$ref":"common.schema.json#/$defs/sha256"},"nonceDigest":{"$ref":"common.schema.json#/$defs/sha256"},"organizationId":{"$ref":"common.schema.json#/$defs/stableId"},"receiptDigest":{"oneOf":[{"type":"null"},{"$ref":"common.schema.json#/$defs/sha256"}]},"replayKeyDigest":{"$ref":"common.schema.json#/$defs/sha256"},"requestDigest":{"$ref":"common.schema.json#/$defs/sha256"},"state":{"enum":["RESERVED","COMMITTED","REJECTED","EXPIRED"]},"updatedAt":{"$ref":"common.schema.json#/$defs/timestamp"}},"required":["organizationId","replayKeyDigest","idempotencyKeyDigest","nonceDigest","admissionDigest","requestDigest","state","firstSeenAt","updatedAt","expiresAt","receiptDigest"],"type":"object"}},"required":["apiVersion","kind","metadata","spec"],"title":"ReplayRecord","type":"object"}
