{"apiVersion":"harness.planeon.ai/v1alpha1","kind":"ReplayRecord","metadata":{"id":"runtime.replay-001","version":"1.0.0"},"spec":{"admissionDigest":"sha256:7777777777777777777777777777777777777777777777777777777777777777","expiresAt":"2030-02-01T00:05:00Z","firstSeenAt":"2030-02-01T00:00:01Z","idempotencyKeyDigest":"sha256:6666666666666666666666666666666666666666666666666666666666666666","nonceDigest":"sha256:cccccccccccccccccccccccccccccccccccccccccccccccccccccccccccccccc","organizationId":"acme.example","receiptDigest":"sha256:dddddddddddddddddddddddddddddddddddddddddddddddddddddddddddddddd","replayKeyDigest":"sha256:bbbbbbbbbbbbbbbbbbbbbbbbbbbbbbbbbbbbbbbbbbbbbbbbbbbbbbbbbbbbbbbb","requestDigest":"sha256:5555555555555555555555555555555555555555555555555555555555555555","state":"COMMITTED","updatedAt":"2030-02-01T00:00:01Z"}}
